{
  "$schema": "https://json-schema.org/draft/2020-12/schema",
  "title": "st-msads-oci input payload",
  "type": "object",
  "required": ["generated_at", "campaigns", "bookings", "jobs", "calls"],
  "additionalProperties": false,
  "$defs": {
    "id": {"type": "integer"},
    "nullableId": {"type": ["integer", "null"]},
    "ts": {"type": "string", "pattern": "^\\d{4}-\\d{2}-\\d{2}T\\d{2}:\\d{2}:\\d{2}(\\.\\d+)?(Z|[+-]\\d{2}:\\d{2})$"},
    "email": {"type": ["string", "null"], "minLength": 3},
    "phones": {"type": "array", "items": {"type": "string", "minLength": 1}},
    "name": {"type": ["string", "null"]}
  },
  "properties": {
    "generated_at": {"$ref": "#/$defs/ts"},
    "campaigns": {"type": "array", "items": {"type": "object", "required": ["id", "name", "category"],
      "properties": {"id": {"$ref": "#/$defs/id"}, "name": {"type": "string"}, "category": {"type": ["string", "null"]}}}},
    "bookings": {"type": "array", "items": {"type": "object",
      "required": ["id", "createdOn", "campaignId", "customerName", "email", "phones"],
      "properties": {"id": {"$ref": "#/$defs/id"}, "createdOn": {"$ref": "#/$defs/ts"}, "campaignId": {"$ref": "#/$defs/nullableId"},
        "customerName": {"$ref": "#/$defs/name"}, "email": {"$ref": "#/$defs/email"}, "phones": {"$ref": "#/$defs/phones"}}}},
    "jobs": {"type": "array", "items": {"type": "object",
      "required": ["id", "completedOn", "campaignId", "customerName", "email", "phones", "invoiceTotal", "leadCallId", "bookingId", "projectId"],
      "properties": {"id": {"$ref": "#/$defs/id"}, "completedOn": {"$ref": "#/$defs/ts"}, "campaignId": {"$ref": "#/$defs/nullableId"},
        "customerName": {"$ref": "#/$defs/name"}, "email": {"$ref": "#/$defs/email"}, "phones": {"$ref": "#/$defs/phones"},
        "invoiceTotal": {"type": ["number", "null"]}, "leadCallId": {"$ref": "#/$defs/nullableId"},
        "bookingId": {"$ref": "#/$defs/nullableId"}, "projectId": {"$ref": "#/$defs/nullableId"}}}},
    "calls": {"type": "array", "items": {"type": "object",
      "required": ["id", "receivedOn", "to", "from", "direction", "campaign"],
      "properties": {"id": {"$ref": "#/$defs/id"}, "receivedOn": {"$ref": "#/$defs/ts"},
        "to": {"type": ["string", "null"]}, "from": {"type": ["string", "null"]}, "direction": {"type": "string"},
        "campaign": {"type": "object", "required": ["id"], "properties": {"id": {"$ref": "#/$defs/nullableId"}}},
        "callType": {"type": "string"}, "customerName": {"$ref": "#/$defs/name"},
        "email": {"$ref": "#/$defs/email"}, "phones": {"$ref": "#/$defs/phones"}},
      "if": {"properties": {"callType": {"const": "Booked"}}, "required": ["callType"]},
      "then": {"required": ["customerName", "email", "phones"]}}},
    "project_jobs": {"type": "object", "additionalProperties": {"type": "array", "items": {"type": "object",
      "required": ["id", "jobStatus", "total", "completedOn", "createdOn", "campaignId", "leadCallId", "bookingId", "partnerLeadCallId", "createdFromEstimateId"],
      "properties": {"id": {"$ref": "#/$defs/id"}, "jobStatus": {"type": "string"}, "total": {"type": ["number", "null"]},
        "completedOn": {"type": ["string", "null"]}, "createdOn": {"$ref": "#/$defs/ts"}, "campaignId": {"$ref": "#/$defs/nullableId"},
        "leadCallId": {"$ref": "#/$defs/nullableId"}, "bookingId": {"$ref": "#/$defs/nullableId"},
        "partnerLeadCallId": {"$ref": "#/$defs/nullableId"}, "createdFromEstimateId": {"$ref": "#/$defs/nullableId"},
        "customerName": {"$ref": "#/$defs/name"}, "email": {"$ref": "#/$defs/email"}, "phones": {"$ref": "#/$defs/phones"}}}}}
  }
}
